{"schema_version":1,"clip_id":"seq011","layer":"infrastructure","type":"polygons","frame_size":[1920,1080],"classes":["gate_exit","barrier","wall","obstruction"],"max_age_frames":125,"frames":{"0":[{"cls":"obstruction","score":0.91,"box":[1020.7,397.0,1047.4,464.0],"polygon":[[1021.5,397.5],[1021.5,462.0],[1023.0,463.5],[1039.5,463.5],[1044.0,459.0],[1047.0,450.0],[1047.0,397.5]]},{"cls":"obstruction","score":0.906,"box":[306.4,505.6,380.7,535.2],"polygon":[[307.5,507.0],[307.5,531.0],[310.5,532.5],[316.5,532.5],[318.0,534.0],[375.0,534.0],[379.5,531.0],[379.5,510.0],[376.5,507.0]]},{"cls":"obstruction","score":0.905,"box":[1310.6,486.0,1387.8,515.7],"polygon":[[1311.0,493.5],[1311.0,510.0],[1317.0,514.5],[1372.5,514.5],[1384.5,510.0],[1387.5,505.5],[1387.5,492.0],[1386.0,487.5],[1317.0,487.5],[1312.5,490.5]]},{"cls":"obstruction","score":0.901,"box":[399.0,503.4,473.0,531.3],"polygon":[[400.5,504.0],[400.5,529.5],[403.5,531.0],[468.0,531.0],[471.0,529.5],[472.5,526.5],[472.5,504.0]]},{"cls":"obstruction","score":0.899,"box":[1637.2,495.6,1711.1,523.4],"polygon":[[1638.0,496.5],[1638.0,519.0],[1644.0,522.0],[1705.5,522.0],[1710.0,519.0],[1710.0,496.5]]},{"cls":"obstruction","score":0.898,"box":[1029.4,1003.0,1056.7,1075.7],"polygon":[[1030.5,1003.5],[1030.5,1075.5],[1050.0,1075.5],[1053.0,1074.0],[1056.0,1069.5],[1056.0,1005.0],[1054.5,1003.5]]},{"cls":"obstruction","score":0.892,"box":[339.6,594.6,411.1,622.2],"polygon":[[340.5,595.5],[340.5,618.0],[346.5,621.0],[408.0,621.0],[411.0,618.0],[411.0,595.5]]},{"cls":"obstruction","score":0.891,"box":[206.1,492.1,279.6,520.7],"polygon":[[207.0,493.5],[207.0,517.5],[213.0,520.5],[276.0,520.5],[279.0,519.0],[279.0,493.5]]},{"cls":"obstruction","score":0.89,"box":[634.5,495.5,704.4,521.9],"polygon":[[636.0,496.5],[636.0,520.5],[700.5,520.5],[703.5,517.5],[703.5,498.0],[702.0,496.5]]},{"cls":"obstruction","score":0.888,"box":[1028.6,891.8,1057.5,963.8],"polygon":[[1029.0,892.5],[1029.0,958.5],[1033.5,963.0],[1053.0,963.0],[1056.0,960.0],[1056.0,892.5]]},{"cls":"obstruction","score":0.883,"box":[1021.5,310.6,1048.9,376.6],"polygon":[[1021.5,312.0],[1021.5,373.5],[1027.5,376.5],[1038.0,376.5],[1048.5,367.5],[1048.5,312.0]]},{"cls":"obstruction","score":0.88,"box":[1049.9,491.5,1119.9,518.7],"polygon":[[1050.0,492.0],[1050.0,514.5],[1053.0,516.0],[1057.5,516.0],[1059.0,517.5],[1116.0,517.5],[1119.0,513.0],[1119.0,498.0],[1114.5,492.0]]},{"cls":"obstruction","score":0.879,"box":[727.5,501.8,795.8,526.8],"polygon":[[727.5,502.5],[727.5,525.0],[729.0,526.5],[790.5,526.5],[795.0,523.5],[795.0,504.0],[793.5,502.5]]},{"cls":"obstruction","score":0.878,"box":[1223.2,483.0,1293.1,510.2],"polygon":[[1224.0,484.5],[1224.0,508.5],[1228.5,508.5],[1230.0,510.0],[1281.0,510.0],[1282.5,508.5],[1293.0,507.0],[1293.0,492.0],[1291.5,487.5],[1288.5,484.5]]},{"cls":"obstruction","score":0.874,"box":[554.8,497.9,621.5,522.1],"polygon":[[555.0,498.0],[555.0,520.5],[558.0,522.0],[618.0,522.0],[621.0,520.5],[621.0,498.0]]},{"cls":"obstruction","score":0.871,"box":[1410.3,485.4,1476.9,511.7],"polygon":[[1411.5,486.0],[1411.5,508.5],[1414.5,510.0],[1419.0,510.0],[1420.5,511.5],[1470.0,511.5],[1476.0,507.0],[1476.0,489.0],[1474.5,486.0]]},{"cls":"obstruction","score":0.868,"box":[1510.8,455.0,1615.3,492.9],"polygon":[[1512.0,459.0],[1512.0,490.5],[1516.5,492.0],[1611.0,492.0],[1614.0,486.0],[1614.0,456.0],[1516.5,456.0]]},{"cls":"obstruction","score":0.867,"box":[1729.9,499.3,1797.3,523.3],"polygon":[[1731.0,499.5],[1731.0,520.5],[1732.5,522.0],[1792.5,522.0],[1797.0,519.0],[1797.0,499.5]]},{"cls":"obstruction","score":0.867,"box":[1133.6,495.3,1203.9,520.6],"polygon":[[1134.0,496.5],[1134.0,517.5],[1140.0,520.5],[1198.5,520.5],[1203.0,517.5],[1203.0,498.0],[1201.5,496.5]]},{"cls":"obstruction","score":0.864,"box":[1.0,587.4,72.5,613.3],"polygon":[[1.5,588.0],[1.5,612.0],[54.0,612.0],[55.5,610.5],[66.0,610.5],[72.0,607.5],[72.0,588.0]]},{"cls":"obstruction","score":0.862,"box":[924.6,992.8,955.1,1077.0],"polygon":[[925.5,993.0],[925.5,1077.0],[952.5,1077.0],[954.0,1075.5],[954.0,994.5],[952.5,993.0]]},{"cls":"wall","score":0.862,"box":[452.2,620.2,882.9,951.3],"polygon":[[453.0,625.5],[453.0,642.0],[457.5,643.5],[459.0,642.0],[463.5,642.0],[465.0,643.5],[465.0,654.0],[466.5,655.5],[460.5,678.0],[456.0,684.0],[453.0,691.5],[453.0,760.5],[454.5,762.0],[453.0,766.5],[453.0,951.0],[516.0,951.0],[517.5,949.5],[531.0,948.0],[543.0,940.5],[549.0,940.5],[550.5,939.0],[571.5,939.0],[589.5,933.0],[598.5,933.0],[606.0,936.0],[612.0,940.5],[622.5,940.5],[624.0,939.0],[640.5,939.0],[642.0,940.5],[651.0,940.5],[652.5,942.0],[664.5,942.0],[666.0,940.5],[721.5,940.5],[723.0,942.0],[736.5,942.0],[741.0,945.0],[730.5,951.0],[882.0,951.0],[882.0,751.5],[877.5,741.0],[877.5,703.5],[879.0,702.0],[879.0,678.0],[880.5,676.5],[880.5,667.5],[879.0,666.0],[879.0,657.0],[876.0,648.0],[871.5,642.0],[861.0,639.0],[858.0,636.0],[850.5,634.5],[840.0,628.5],[831.0,628.5],[823.5,625.5],[786.0,627.0],[784.5,625.5],[775.5,624.0],[771.0,621.0],[471.0,621.0],[471.0,622.5],[465.0,627.0]]},{"cls":"obstruction","score":0.851,"box":[1011.0,1.3,1049.8,117.8],"polygon":[[1012.5,1.5],[1012.5,117.0],[1038.0,117.0],[1044.0,109.5],[1047.0,100.5],[1047.0,91.5],[1048.5,90.0],[1048.5,1.5]]},{"cls":"obstruction","score":0.848,"box":[987.1,399.9,1013.7,464.6],"polygon":[[988.5,400.5],[988.5,462.0],[991.5,463.5],[1008.0,463.5],[1012.5,460.5],[1012.5,408.0],[1011.0,406.5],[1011.0,402.0],[1009.5,400.5]]},{"cls":"obstruction","score":0.836,"box":[1901.2,504.8,1920.0,531.6],"polygon":[[1902.0,505.5],[1902.0,528.0],[1906.5,531.0],[1918.5,531.0],[1918.5,505.5]]},{"cls":"obstruction","score":0.836,"box":[1017.3,157.7,1053.5,286.9],"polygon":[[1018.5,159.0],[1018.5,283.5],[1023.0,286.5],[1044.0,286.5],[1050.0,282.0],[1053.0,273.0],[1053.0,159.0]]},{"cls":"obstruction","score":0.835,"box":[0.0,495.5,34.5,522.0],"polygon":[[0.0,496.5],[0.0,520.5],[28.5,520.5],[34.5,516.0],[34.5,498.0],[33.0,496.5]]},{"cls":"obstruction","score":0.821,"box":[270.2,597.3,328.4,620.0],"polygon":[[271.5,598.5],[271.5,616.5],[274.5,618.0],[280.5,618.0],[282.0,619.5],[322.5,619.5],[327.0,616.5],[327.0,598.5]]},{"cls":"obstruction","score":0.813,"box":[1822.9,459.9,1920.0,496.2],"polygon":[[1824.0,460.5],[1824.0,493.5],[1825.5,495.0],[1918.5,495.0],[1918.5,460.5]]},{"cls":"obstruction","score":0.794,"box":[468.2,448.3,549.3,484.9],"polygon":[[469.5,448.5],[469.5,484.5],[547.5,484.5],[549.0,483.0],[549.0,448.5]]},{"cls":"wall","score":0.788,"box":[2.0,615.6,453.4,980.4],"polygon":[[3.0,616.5],[3.0,979.5],[250.5,979.5],[258.0,973.5],[268.5,973.5],[276.0,976.5],[303.0,978.0],[304.5,979.5],[327.0,979.5],[328.5,978.0],[343.5,978.0],[345.0,979.5],[346.5,978.0],[367.5,978.0],[369.0,979.5],[426.0,979.5],[426.0,973.5],[432.0,969.0],[430.5,961.5],[435.0,955.5],[435.0,952.5],[438.0,948.0],[441.0,946.5],[445.5,948.0],[453.0,954.0],[453.0,919.5],[451.5,921.0],[450.0,919.5],[447.0,910.5],[447.0,906.0],[448.5,904.5],[448.5,883.5],[453.0,870.0],[453.0,624.0],[435.0,624.0],[433.5,622.5],[424.5,622.5],[423.0,621.0],[414.0,621.0],[408.0,624.0],[361.5,624.0],[360.0,622.5],[348.0,622.5],[333.0,616.5],[325.5,621.0],[283.5,621.0],[282.0,619.5],[273.0,619.5],[271.5,618.0],[264.0,618.0],[262.5,616.5]]},{"cls":"obstruction","score":0.783,"box":[513.5,595.4,582.2,616.0],"polygon":[[514.5,595.5],[514.5,615.0],[580.5,615.0],[582.0,613.5],[582.0,598.5],[580.5,595.5]]},{"cls":"obstruction","score":0.777,"box":[167.9,595.6,239.0,615.0],"polygon":[[168.0,597.0],[168.0,610.5],[177.0,612.0],[178.5,613.5],[186.0,613.5],[187.5,615.0],[231.0,615.0],[235.5,613.5],[238.5,610.5],[238.5,597.0]]},{"cls":"wall","score":0.772,"box":[60.3,1.2,909.4,436.5],"polygon":[[61.5,1.5],[61.5,420.0],[73.5,421.5],[84.0,417.0],[109.5,417.0],[111.0,415.5],[126.0,415.5],[129.0,414.0],[130.5,415.5],[153.0,417.0],[169.5,423.0],[184.5,424.5],[186.0,426.0],[195.0,426.0],[208.5,430.5],[231.0,429.0],[243.0,433.5],[256.5,433.5],[258.0,435.0],[262.5,433.5],[292.5,433.5],[294.0,432.0],[307.5,432.0],[309.0,430.5],[319.5,430.5],[321.0,429.0],[411.0,430.5],[412.5,432.0],[469.5,432.0],[471.0,430.5],[478.5,430.5],[480.0,429.0],[499.5,429.0],[501.0,430.5],[507.0,430.5],[508.5,432.0],[520.5,433.5],[522.0,435.0],[847.5,435.0],[862.5,426.0],[874.5,412.5],[877.5,405.0],[877.5,397.5],[879.0,396.0],[879.0,373.5],[880.5,372.0],[880.5,313.5],[879.0,312.0],[879.0,285.0],[880.5,283.5],[880.5,211.5],[879.0,210.0],[879.0,195.0],[877.5,193.5],[877.5,169.5],[879.0,168.0],[879.0,132.0],[877.5,127.5],[879.0,126.0],[879.0,87.0],[880.5,85.5],[880.5,39.0],[879.0,37.5],[879.0,30.0],[880.5,28.5],[882.0,1.5]]},{"cls":"obstruction","score":0.688,"box":[426.2,594.7,488.8,622.3],"polygon":[[427.5,595.5],[427.5,621.0],[465.0,621.0],[474.0,616.5],[487.5,613.5],[487.5,595.5]]},{"cls":"obstruction","score":0.666,"box":[971.5,1050.9,997.5,1078.8],"polygon":[[972.0,1051.5],[972.0,1078.5],[994.5,1078.5],[996.0,1077.0],[996.0,1051.5]]},{"cls":"obstruction","score":0.644,"box":[124.2,487.9,195.4,515.7],"polygon":[[124.5,489.0],[124.5,514.5],[192.0,514.5],[195.0,513.0],[195.0,489.0]]},{"cls":"obstruction","score":0.594,"box":[211.1,449.0,276.4,477.4],"polygon":[[211.5,450.0],[211.5,475.5],[213.0,477.0],[274.5,477.0],[276.0,475.5],[276.0,450.0]]},{"cls":"wall","score":0.569,"box":[1047.9,643.2,1886.9,1006.8],"polygon":[[1060.5,658.5],[1057.5,667.5],[1057.5,676.5],[1059.0,678.0],[1060.5,699.0],[1062.0,700.5],[1063.5,721.5],[1065.0,723.0],[1066.5,790.5],[1062.0,796.5],[1053.0,799.5],[1050.0,804.0],[1056.0,813.0],[1054.5,840.0],[1053.0,841.5],[1056.0,849.0],[1051.5,855.0],[1048.5,853.5],[1048.5,879.0],[1054.5,880.5],[1059.0,885.0],[1059.0,894.0],[1060.5,895.5],[1060.5,958.5],[1054.5,966.0],[1048.5,966.0],[1048.5,993.0],[1057.5,994.5],[1060.5,997.5],[1063.5,1006.5],[1443.0,1006.5],[1444.5,1005.0],[1444.5,997.5],[1449.0,993.0],[1453.5,993.0],[1455.0,991.5],[1468.5,991.5],[1470.0,990.0],[1477.5,990.0],[1479.0,988.5],[1488.0,988.5],[1489.5,990.0],[1497.0,990.0],[1501.5,993.0],[1506.0,993.0],[1512.